{
    "tnc_version": 1,
    "privacy_version": 1,
    "gender":"male",
    "msisdn": "qVPZBb26DBueOiHz+uiZlO3Ym0Lgx7UqjcoyPqgcNz+Lr1SX09fLCpc8agf/RO04TGTc6NA9eNztJceBPS6s0hn3WcxMKMffNjuPr5TTX+98JYGDTtyXOpAm8LYB0FK23TrRw5fXvNsPDy4tg/Yb2D3HrQwgGag0VJIVgsUKM+P0Y9XuNmzE4I0P+dn1LoXADkp3JG6v//JgSix02kKFcgijSHCgestJ7bR2CqbH8hjebahIO6lDCkh8VTNLDfnInSEbD/WW8JUh6hxebKbYiEPaQa/XxZJHvDqJlmMj0KM3CO9A3YRHOagOs9dbaOHp0Rx3Hg02jzY2KTq6Dmp07A==",
    "crypto_exchange": {
        "version": "1.0",
        "payload": "RVvvStnwxFd70aBKNJkr4vBrTElF7K7jSGo/ajdFX7czsdI+6q3LHaX+S69qdOjV5XOrVN0p+UM4YwutdEJsHkV0Dp3FHb+O40yYFp4wFwCZ/JheysJMpQMEsdKiIIzzYQ+AYK8mXSmd9xWzLFX4CyWJaMhy6z9K7eRgTMP6SP0fSr6sHCpjcNqVwMxraVrs+dVSFBX4kV2XbrY5GXM6ER8wRzVwMWbmQm2/lRj8DhmnwY84CnjRFFpZV9Mn1RiviZxyb86dpDylrmL8s5sz7VJ2C+5je9Z+r4k6By22dY6s/cNEnLFNZgJCVCYrxaHW3WKvZsL5qmdLAB7F1Nr0hA==",
        "iv": "Y65wlPqX21qAM9fgI9l5GA==",
        "hmac": "EbNB/3CMVh6P7KUIpZsRSOYFK3necbfSpwQJ6sx6vRM=",
        "ctoken": "2f255e99-3a34-4eed-be75-32bb6f3c13f9"
    },
    "languages": [
        "en",
        "hi"
    ]
}